{
  "format": "fb-layout/1",
  "kind": "layout_request",
  "request_id": "example-single-course",
  "snapshot_hash": "0000000000000000000000000000000000000000000000000000000000000000",
  "coordinate_system": {"id": "example-world", "units": "mm", "coordinate_quantum_mm": 0.01, "z0_mm": -252},
  "profile": {"id": "example-profile", "revision": "1"},
  "catalog": {"id": "example-catalog", "revision": "1"},
  "scope": {"mode": "full"},
  "model": {
    "wall_volumes": [{
      "id": "wall-example",
      "purpose": "fb_wall",
      "volume": {
        "start_xy_mm": [0, 0], "end_xy_mm": [440, 0],
        "bottom_start_mm": -252, "bottom_end_mm": -252,
        "top_start_mm": -189, "top_end_mm": -189,
        "left_thickness_mm": 96.5, "right_thickness_mm": 96.5
      }
    }],
    "openings": [],
    "beams": []
  }
}
