{
  "format": "fb-layout/1",
  "kind": "layout_result",
  "request_id": "example-vertical-review",
  "snapshot_hash": "2222222222222222222222222222222222222222222222222222222222222222",
  "coordinate_system": {"id": "example-world", "units": "mm", "coordinate_quantum_mm": 0.01, "z0_mm": -252},
  "profile": {"id": "example-profile", "revision": "1"},
  "catalog": {"id": "example-catalog", "revision": "1"},
  "scope": {"mode": "full"},
  "status": "success",
  "blocks": [{
    "id": "part-example-1",
    "source_ids": ["wall-example"], "wall_ids": ["wall-example"], "course_index": 1,
    "product": {"category": "standard", "type_id": "example-rectangular-p640", "code": "EXAMPLE-P640", "nominal_size_mm": [640, 193, 63]},
    "placement": {"origin_mm": [0, -96.5, -189], "x_axis": [1, 0, 0], "y_axis": [0, 1, 0], "z_axis": [0, 0, 1]},
    "stock_shape": {"kind": "box", "size_mm": [640, 193, 63]},
    "cuts": [],
    "spikes_removed": {"left": false, "right": false}
  }],
  "beam_adjustments": [],
  "warnings": [{
    "code": "NODE_VERTICAL_RULE_MISSING",
    "message": "Нет подтверждённой геометрии соседнего венца для проверки вертикального соединения",
    "source_ids": ["wall-example"],
    "course_index": 1
  }]
}
